"008973","大成中华沪深港300指数(LOF)C"
"004145","上投安丰回报C"
"001475","易方达国防军工混合"
"001507","景顺长城泰和回报混合C"
"008072","景顺长城创业板综指增强"
"008253","华宝致远混合(QDII)A"
"001037","国投瑞银锐意改革混合"
"001223","鹏华文化传媒娱乐股票"
"001247","华泰柏瑞新利混合A"
"000130","大成景兴信用债债券A"
"210001","金鹰成份优选混合"
"008763","天弘越南市场股票(QDII)A"
"008681","鹏华价值成长混合"
"006213","东方臻选纯债债券C"
"005460","银河嘉谊灵活配置混合C"
"005886","华夏鼎沛债券A"
"005644","广发沪港深龙头混合"
"008120","万家自主创新混合A"
"008079","诺德大类精选(FOF)"
"003459","嘉实稳宏债券C"
"001286","易方达新鑫混合E"
"253020","国联安增利债券A"
"009265","易方达消费精选股票"
"008390","国联安沪深300ETF联接A"
"003063","银华通利混合C"
"004194","招商中证1000指数增强A"
"002091","华泰柏瑞新利混合C"
"008764","天弘越南市场股票(QDII)C"
"001318","东方新策略灵活配置混合A"
"008391","国联安沪深300ETF联接C"
"000390","华商优势行业混合"
"002212","嘉实新起航混合"
"008162","浦银安盛经济带崛起混合C"
"671010","西部利得策略优选混合A"
"001116","广发聚安混合C"
"519975","长信量化中小盘股票"
"001412","德邦鑫星价值灵活配置混合A"
"008254","华宝致远混合(QDII)C"
"001589","天弘中证800指数C"
"005216","南方全天候策略(FOF)C"
"673010","西部利得新动向混合"
"000613","国寿安保沪深300ETF联接"
"005824","泰康颐享混合C"
"002952","建信多因子量化股票"
"011060","西部利得策略优选混合C"
"007788","易方达中证国企带路发起式联接A"
"000333","长城稳固收益债券A"
"161722","招商丰泰混合(LOF)"
"005120","上投摩根量化多因子混合"
"004641","万家量化睿选混合"
"000217","华安黄金易ETF联接C"
"008778","嘉实中证500指数增强A"
"008121","万家自主创新混合C"
"004100","鹏华安益增强混合"
"004195","招商中证1000指数增强C"
"006843","中信建投睿溢混合C"
"007789","易方达中证国企带路发起式联接C"
"008230","九泰天辰量化新动力"
"009707","工银新兴制造混合A"
"000708","华安安享混合"
"001464","光大鼎鑫混合A"
"001218","国投瑞银精选收益混合"
"002178","嘉实新起点混合C"
"002983","长信国防军工量化混合A"
"001325","鹏华弘和混合A"
"002000","工银新生利混合"
"002144","华安新优选灵活配置混合C"
"290010","泰信中证200指数"
"007614","德邦民裕进取量化精锐股票A"
"005095","国泰量化成长优选混合A"
"160123","南方中债10年期国债A"
"008199","华夏创新100ETF联接A"
"000001","华夏成长混合"
"008779","嘉实中证500指数增强C"
"009708","工银新兴制造混合C"
"005887","华夏鼎沛债券C"
"007770","同泰开泰混合A"
"519625","银河君盛混合A"
"008954","安信价值回报三年持有混合A"
"003028","安信新优选混合A"
"010667","安信价值回报三年持有混合C"
"008960","长信国防军工量化混合C"
"003411","鹏华弘康灵活配置混合A"
"008200","华夏创新100ETF联接C"
"002490","金鹰元祺信用债"
"000667","工银绝对收益混合发起A"
"009086","鹏华价值共赢两年持有期混合"
"485107","工银添利债券A"
"519134","海富通富祥混合"
"160620","鹏华中证A股资源产业指数(LOF)"
"000526","国泰浓益灵活配置混合A"
"675083","西部利得祥盈债券C"
"002236","大成360互联网+大数据100A"
"003496","鹏华弘尚灵活配置混合C"
"000054","鹏华双债增利债券"
"213007","宝盈增强收益债券A/B"
"004651","长信利丰债券E"
"007771","同泰开泰混合C"
"005991","长信利丰债券A"
"004442","中欧康裕混合A"
"007615","德邦民裕进取量化精锐股票C"
"003116","光大诚鑫混合C"
"070015","嘉实多元债券A"
"005373","中加紫金灵活配置混合A"
"519626","银河君盛混合C"
"004192","招商中证500指数A"
"002018","鹏华弘安混合A"
"001739","中融融安混合二号"
"004455","中欧康裕混合C"
"001817","易方达瑞兴灵活配置混合I"
"004916","嘉实新添丰定期混合"
"002636","广发集裕债券A"
"519222","海富通欣益混合A"
"008734","交银科锐科技创新混合"
"000149","华安双债添利债券A"
"003029","安信新优选混合C"
"001326","鹏华弘和混合C"
"008037","兴银先锋成长混合A"
"007944","永赢乾元三年定开"
"360008","光大增利收益债券A"
"001230","鹏华医药科技"
"005999","嘉实中证金融地产ETF联接C"
"004047","华夏新锦顺混合C"
"005429","渤海汇金睿选混合A"
"001265","国泰兴益灵活配置混合A"
"009098","景顺长城价值领航混合"
"008533","惠升惠兴混合A"
"007338","前海联合泳辉纯债C"
"003143","鹏华弘达混合C"
"070016","嘉实多元债券B"
"002866","新华丰盈回报债券"
"004790","富荣中证500指数A"
"000189","易方达丰华债券A"
"002714","鹏华金城混合"
"005169","华泰保兴策略精选A"
"161506","银河通利债券(LOF)C"
"003115","光大诚鑫混合A"
"008534","惠升惠兴混合C"
"206003","鹏华信用增利债券A"
"001188","鹏华改革红利股票"
"006537","恒生前海港股通精选混合"
"004710","民生加银鹏程混合A"
"005039","鹏扬景兴混合A"
"004193","招商中证500指数C"
"002075","光大睿鑫混合C"
"001818","易方达瑞兴灵活配置混合E"
"007875","国融融兴混合A"
"006129","华安中证500低波ETF联接A"
"210002","金鹰红利价值混合"
"519163","新华增怡债券C"
"003493","申万菱信安鑫优选混合A"
"005561","创金合信红利低波动A"
"580007","东吴安享量化混合"
"005933","前海联合先进制造混合A"
"003379","信诚至选混合A"
"004202","华夏睿磐泰兴混合"
"001402","信诚新选混合A"
"001540","浙商汇金转型驱动"
"003332","南方荣发混合"
"009128","明亚价值长青混合A"
"004791","富荣中证500指数C"
"003380","信诚至选混合C"
"000334","长城稳固收益债券C"
"002455","民生加银鑫喜混合"
"007876","国融融兴混合C"
"470888","汇添富香港混合(QDII)"
"007036","前海联合永兴纯债C"
"007815","嘉实新兴科技100ETF联接A"
"000131","大成景兴信用债债券C"
"003591","华泰柏瑞享利混合A"
"005374","中加紫金灵活配置混合C"
"005128","华夏永康添福混合"
"003275","国联安添利增长债A"
"004671","中融核心成长"
"002211","嘉实新财富混合"
"160602","鹏华普天债券A"
"002518","民生加银鑫福混合A"
"009129","明亚价值长青混合C"
"001800","华安新乐享混合"
"501089","方正富邦消费红利指数增强(LOF)"
"253021","国联安增利债券B"
"090017","大成可转债增强债券"
"002384","九泰鸿祥服务升级灵活配置混合"
"004738","上投摩根安隆回报A"
"006255","中邮中证价值回报量化策略A"
"000585","嘉实对冲套利定期混合"
"519937","长信先锐混合A"
"007816","嘉实新兴科技100ETF联接C"
"005562","创金合信红利低波动C"
"530001","建信恒久价值混合"
"006867","易方达丰华债券C"
"360009","光大增利收益债券C"
"005040","鹏扬景兴混合C"
"003125","中科沃土沃鑫成长精选混合A"
"002986","泰康丰盈债券"
"007277","恒生前海消费升级混合"
"006878","天治量化核心精选混合C"
"003592","华泰柏瑞享利混合C"
"001524","华泰柏瑞精选回报混合"
"485007","工银添利债券B"
"001485","华安添颐混合"
"001823","光大鼎鑫混合C"
"003512","申万菱信安鑫优选混合C"
"002162","东方新价值混合C"
"001139","华安新动力灵活配置混合"
"005096","国泰量化成长优选混合C"
"008840","德邦大消费混合A"
"003485","金鹰鑫益混合C"
"519683","交银双利债券A/B"
"001755","嘉实新思路混合"
"002292","诺安益鑫灵活配置混合"
"008038","兴银先锋成长混合C"
"009747","中科沃土沃鑫成长精选混合C"
"000041","华夏全球股票(QDII)"
"008961","华商科技创新混合"
"000973","新华增盈回报债券"
"010476","太平恒久纯债"
"004888","财通资管鑫逸混合A"
"008841","德邦大消费混合C"
"004011","华泰柏瑞鼎利灵活配置混合C"
"003484","金鹰鑫益混合A"
"002161","银华万物互联灵活配置混合"
"002112","德邦鑫星价值灵活配置混合C"
"400016","东方强化收益债券"
"008269","大成睿享混合A"
"005934","前海联合先进制造混合C"
"006618","长江可转债债券A"
"001648","工银新价值灵活配置混合"
"003799","华安新泰利灵活配置混合A"
"005646","中海沪港深多策略灵活配置混合"
"460300","华泰柏瑞沪深300ETF联接A"
"005170","华泰保兴策略精选C"
"001457","华商新常态混合"
"519766","交银荣鑫灵活配置混合"
"003359","大成360互联网+大数据100C"
"005358","东方阿尔法精选混合A"
"006130","华安中证500低波ETF联接C"
"008962","建信科技创新混合A"
"008918","长信先锐混合C"
"001604","浙商汇金转型升级灵活配置混合"
"007932","鹏华中证500ETF联接A"
"007410","浦银安盛中证高股息ETF联接A"
"004135","申万菱信量化成长混合"
"008185","诺安研究优选混合"
"161725","招商中证白酒指数(LOF)"
"001061","华夏收益债券(QDII)A"
"160921","大成多策略混合(LOF)"
"006057","鹏华丰和债券(LOF)C"
"005088","嘉实新添辉定期混合A"
"004546","建信量化优享定开混合"
"005177","华夏睿磐泰利混合A"
"002742","泓德裕祥债券A"
"007388","上投摩根研究驱动A"
"001283","红塔红土盛金新动力混合A"
"000307","易方达黄金ETF联接A"
"006256","中邮中证价值回报量化策略C"
"002637","广发集裕债券C"
"004617","建信鑫稳回报灵活配置混合A"
"004739","上投摩根安隆回报C"
"001530","万家瑞富灵活配置混合"
"310358","申万菱信新经济混合"
"004852","广发价值回报混合A"
"000845","国投瑞银信息消费混合"
"005430","渤海汇金睿选混合C"
"008001","鹏华中证500ETF联接C"
"450018","国富恒久信用债券A"
"008270","大成睿享混合C"
"002522","永赢双利债券C"
"002521","永赢双利债券A"
"002030","信诚新选混合B"
"162412","华宝中证医疗指数"
"007411","浦银安盛中证高股息ETF联接C"
"519162","新华增怡债券A"
"240019","华宝中证银行ETF联接A"
"002728","华富益鑫灵活配置混合A"
"002837","华夏网购精选混合A"
"005844","东方人工智能主题混合"
"008963","建信科技创新混合C"
"004889","财通资管鑫逸混合C"
"519738","交银周期回报灵活配置混合A"
"002820","招商丰美混合C"
"000150","华安双债添利债券C"
"009188","鹏华股息精选混合"
"006131","华泰柏瑞沪深300ETF联接C"
"008124","中邮中证500指数增强C"
"001721","工银新增益混合"
"001414","中融鑫起点混合C"
"000968","广发养老指数A"
"160124","南方中债10年期国债C"
"004618","建信鑫稳回报灵活配置混合C"
"001284","红塔红土盛金新动力混合C"
"008303","宝盈龙头优选股票A"
"002819","招商丰美混合A"
"006619","长江可转债债券C"
"009242","中加核心智造混合A"
"007389","上投摩根研究驱动C"
"009880","安信成长动力一年持有混合"
"003502","金鹰鑫瑞混合A"
"730001","方正富邦创新动力混合A"
"161505","银河通利债券(LOF)A"
"166025","中欧远见两年定开混合A"
"001795","上投摩根文体休闲灵活配置混合"
"519190","万家双利债券"
"162105","金鹰持久增利债券(LOF)C"
"009062","财通智慧成长混合A"
"165509","信诚增强收益债券(LOF)"
"006603","嘉实互融精选股票"
"501092","交银瑞思三年封闭运作混合"
"001468","广发改革混合"
"001904","光大欣鑫混合C"
"003601","申万菱信安鑫精选混合A"
"003276","国联安添利增长债C"
"005178","华夏睿磐泰利混合C"
"001273","民生加银新动力混合A"
"009243","中加核心智造混合C"
"003182","华富弘鑫混合A"
"005102","工银沪深300ETF联接A"
"001983","中邮低碳配置混合"
"006697","华宝中证银行ETF联接C"
"003412","鹏华弘康灵活配置混合C"
"008396","博时中证500ETF联接A"
"519759","交银周期回报灵活配置混合C"
"003495","鹏华弘尚灵活配置混合A"
"005437","易方达易百智能量化策略A"
"005197","工银沪港深精选混合A"
"007839","汇添富中证长三角ETF联接A"
"007385","华泰保兴安盈定开混合"
"006140","广发集嘉债券A"
"001743","诺安优选回报混合"
"003187","嘉实安益混合"
"400027","东方双债添利债券A"
"003800","华安新泰利灵活配置混合C"
"160222","国泰国证食品饮料行业(LOF)"
"001007","国联安鑫安灵活配置混合"
"002323","银华稳利灵活配置混合C"
"002963","易方达黄金ETF联接C"
"260110","景顺长城精选蓝筹混合"
"003602","申万菱信安鑫精选混合C"
"001745","易方达瑞富灵活配置混合I"
"720003","财通收益增强债券A"
"007518","东方阿尔法优选混合A"
"519229","海富通欣享灵活配置混合A"
"007316","交银可转债债券A"
"005359","东方阿尔法精选混合C"
"008304","宝盈龙头优选股票C"
"003603","景顺长城泰安回报混合A"
"009119","广发品质回报混合A"
"501032","财通福盛混合发起(LOF)"
"590007","中邮中证500指数增强A"
"005103","工银沪深300ETF联接C"
"008397","博时中证500ETF联接C"
"001746","易方达瑞富灵活配置混合E"
"400029","东方双债添利债券C"
"002743","泓德裕祥债券C"
"007466","华泰柏瑞中证低波动ETF联接A"
"460008","华泰柏瑞稳健收益债券A"
"004010","华泰柏瑞鼎利灵活配置混合A"
"009063","财通智慧成长混合C"
"002383","大成趋势回报灵活配置混合"
"005583","易方达港股通红利混合"
"007840","汇添富中证长三角ETF联接C"
"002561","东吴安鑫量化混合"
"450019","国富恒久信用债券C"
"002982","广发养老指数C"
"502048","易方达上证50指数(LOF)"
"002474","中邮睿信增强债"
"007939","华夏网购精选混合C"
"004853","广发价值回报混合C"
"008992","申万菱信安鑫慧选混合C"
"008991","申万菱信安鑫慧选混合A"
"009023","鹏华稳健回报混合"
"006141","广发集嘉债券C"
"009474","国泰致远优势混合"
"006877","天治量化核心精选混合A"
"009120","广发品质回报混合C"
"519690","交银稳健配置混合A"
"007454","民生加银嘉盈债券"
"519610","银河旺利混合A"
"004760","国寿安保稳瑞混合A"
"009225","天弘中证中美互联网(QDII)A"
"008871","大成睿裕六月持有股票A"
"008919","永赢科技驱动A"
"002871","华夏智胜价值成长A"
"002111","华宝新起点混合"
"000207","建信双债增强债券A"
"001313","上投摩根智慧互联股票"
"003604","景顺长城泰安回报混合C"
"008893","创金合信鑫利混合A"
"003662","鹏华永盛一年定开债"
"160643","鹏华空天军工指数(LOF)A"
"004761","国寿安保稳瑞混合C"
"006926","长城量化精选股票A"
"007317","交银可转债债券C"
"005089","嘉实新添辉定期混合C"
"009226","天弘中证中美互联网(QDII)C"
"011463","长城量化精选股票C"
"009199","万家价值优势一年持有期混合"
"005438","易方达易百智能量化策略C"
"008920","永赢科技驱动C"
"007519","东方阿尔法优选混合C"
"003183","华富弘鑫混合C"
"003283","信诚至裕灵活配置混合C"
"005198","工银沪港深精选混合C"
"007467","华泰柏瑞中证低波动ETF联接C"
"001932","国寿安保灵活优选混合"
"010190","嘉实价值发现三个月定开混合"
"002872","华夏智胜价值成长C"
"001136","易方达裕如混合"
"519030","海富通稳固收益债券"
"501309","国泰恒生港股通指数(LOF)"
"002421","新华增强债券A"
"398031","中海蓝筹混合"
"580006","东吴新经济混合"
"009029","工银高质量成长混合A"
"007101","中欧远见两年定开混合C"
"008050","同泰慧择混合A"
"008872","大成睿裕六月持有股票C"
"008894","创金合信鑫利混合C"
"161902","万家增强收益债券"
"005833","工银红利优享混合A"
"005126","银河量化稳进混合"
"001328","鹏华弘华混合C"
"008180","同泰慧利混合A"
"003928","前海联合永兴纯债A"
"270005","广发聚丰混合A"
"005140","华夏睿磐泰荣混合A"
"160608","鹏华普天债券B"
"001806","易方达瑞智灵活配置混合I"
"006578","泰康中证港股通非银指数A"
"009330","鹏华成长价值混合A"
"485119","工银信用纯债债券A"
"519152","新华纯债添利债券发起A"
"002019","鹏华弘安混合C"
"002005","工银新得利混合"
"007721","天弘标普500(QDII-FOF)A"
"004750","广发鑫和灵活配置混合A"
"010025","广发聚丰混合C"
"165312","建信央视财经50指数(LOF)"
"002738","泓德裕康债券A"
"002245","泰康稳健增利债券A"
"009043","九泰久信量化股票"
"001180","广发医药卫生联接A"
"005943","工银聚福混合A"
"008181","同泰慧利混合C"
"002549","嘉实稳祥纯债债券A"
"020021","国泰上证180金融ETF联接"
"003221","新华丰利债券A"
"007674","工银产业升级股票A"
"000072","华安稳健回报混合"
"200013","长城积极增利债券A"
"008051","同泰慧择混合C"
"001664","平安鑫安混合A"
"009030","工银高质量成长混合C"
"000804","中信建投稳利混合A"
"009519","中欧鼎利债券E"
"008407","恒生沪深港通细分行业龙头A"
"673043","西部利得行业主题优选混合C"
"001063","华夏收益债券(QDII)C"
"001303","银华稳利灵活配置混合A"
"900052","中信证券臻选回报混合B"
"900022","中信证券臻选回报混合A"
"007722","天弘标普500(QDII-FOF)C"
"000736","诺安聚利债券A"
"001166","建信环保产业股票"
"002270","东吴安盈量化混合"
"004206","华商元亨灵活配置混合"
"008077","九泰天奕量化价值混合A"
"519611","银河旺利混合C"
"519933","长信利发债券"
"005834","工银红利优享混合C"
"008052","工银湾创100ETF联接A"
"900152","中信证券臻选回报混合C"
"008635","华安科技创新混合"
"004775","嘉实新添泽定期混合"
"202801","南方全球精选配置"
"001011","华夏希望债券A"
"008110","九泰科盈价值混合A"
"009520","中欧鼎利债券C"
"009331","鹏华成长价值混合C"
"008408","恒生沪深港通细分行业龙头C"
"320001","诺安平衡混合"
"006579","泰康中证港股通非银指数C"
"009312","前海联合价值优选混合A"
"519024","海富通稳健添利债券A"
"002586","金鹰添利信用债债券A"
"007784","广发央企创新驱动ETF联接A"
"008136","九泰科盈价值混合C"
"008442","九泰科新优享混合C"
"007046","方正富邦创新动力混合C"
"290004","泰信优质生活混合"
"002965","中海合嘉增强收益债券A"
"519967","长信利富债券"
"519685","交银双利债券C"
"002398","华安安禧混合A"
"005141","华夏睿磐泰荣混合C"
"167302","方正富邦大湾区综指(LOF)"
"000672","工银绝对收益混合发起B"
"001304","建信鑫安回报灵活配置混合"
"007785","广发央企创新驱动ETF联接C"
"004438","鹏华永安定期开放债券"
"002978","广发医药卫生联接C"
"002411","华夏新机遇混合A"
"002729","华富益鑫灵活配置混合C"
"519628","银河君润混合C"
"009313","前海联合价值优选混合C"
"009456","东方稳健回报债券C"
"519627","银河君润混合A"
"008053","工银湾创100ETF联接C"
"400009","东方稳健回报债券A"
"005944","工银聚福混合C"
"006196","华夏中证央企ETF联接A"
"003318","景顺中证500行业中性低波动"
"004224","南方军工改革灵活配置混合A"
"213917","宝盈增强收益债券C"
"002966","中海合嘉增强收益债券C"
"008137","九泰天奕量化价值混合C"
"007675","工银产业升级股票C"
"519782","交银裕隆纯债债券A"
"007110","国投瑞银港股通混合A"
"008441","九泰科新优享混合A"
"008974","长城稳健增利债券C"
"011148","南方军工改革灵活配置混合C"
"519688","交银精选混合"
"501189","嘉实战略配售(LOF)"
"519017","大成积极成长混合"
"002587","金鹰添利信用债债券C"
"011081","国投瑞银港股通混合C"
"007257","凯石沣混合A"
"001416","嘉实事件驱动股票"
"001448","华商双翼平衡混合"
"005159","华泰保兴尊合债券A"
"003704","光大事件驱动混合"
"005209","东吴双三角股票A"
"501200","民生加银科创3年封闭混合"
"009152","南方瑞盛三年混合A"
"001807","易方达瑞智灵活配置混合E"
"501098","建信科技创新3年封闭混合"
"502003","易方达中证军工(LOF)"
"003760","国泰中证500指数增强A"
"009153","南方瑞盛三年混合C"
"002422","新华增强债券C"
"900029","中信证券量化优选A"
"009988","信达澳银蓝筹精选股票"
"004255","民生加银汇鑫一年定开债C"
"004521","安信工业4.0灵活配置混合A"
"161715","招商大宗商品(LOF)"
"550004","信诚三得益债券A"
"350006","天治稳健双盈债券"
"000935","浙商汇金转型成长"
"002305","光大风格轮动混合A"
"002739","泓德裕康债券C"
"002804","华泰柏瑞量化对冲"
"002136","广发鑫源混合C"
"005035","银华信息科技量化股票发起式A"
"006197","华夏中证央企ETF联接C"
"007049","平安鑫安混合E"
"003222","新华丰利债券C"
"006781","汇丰晋信港股通精选股票"
"003343","鹏华弘惠灵活配置混合A"
"004751","广发鑫和灵活配置混合C"
"005036","银华信息科技量化股票发起式C"
"001294","新华战略新兴产业灵活配置混合"
"270009","广发增强债券"
"000310","安信永利信用A"
"002492","工银月月薪定期支付债券C"
"005160","华泰保兴尊合债券C"
"009264","泓德瑞兴三年持有期混合"
"001453","鹏华弘鑫混合A"
"006656","方正富邦中证500ETF联接A"
"000208","建信双债增强债券C"
"008212","华夏新机遇混合C"
"460002","华泰柏瑞积极成长混合A"
"002736","泓德裕和纯债债券A"
"000129","大成景安短融债券B"
"003344","鹏华弘惠灵活配置混合C"
"004522","安信工业4.0灵活配置混合C"
"180015","银华增强收益债券"
"001343","易方达新享混合C"
"005280","安信稳健阿尔法定开混合A"
"860038","光大阳光智造混合B"
"161121","易方达中证银行指数(LOF)A"
"519783","交银裕隆纯债债券C"
"900030","中信证券量化优选C"
"001665","平安鑫安混合C"
"100050","富国全球债券(QDII)"
"008526","华泰柏瑞行业精选A"
"006845","中信建投聚利混合C"
"395011","中海增强收益债券A"
"460108","华泰柏瑞稳健收益债券C"
"009860","易方达中证银行指数(LOF)C"
"004571","万家家瑞债券A"
"180025","银华信用双利债券A"
"002600","易方达裕景添利6个月定开债"
"160637","鹏华创业板指数(LOF)"
"860039","光大阳光智造混合C"
"005523","泰康颐年混合A"
"001073","华泰柏瑞量化绝对收益混合"
"160725","嘉实基本面50指数(LOF)C"
"007729","招商普盛全球配置(QDII-FOF)人民币"
"008949","平安匠心优选混合A"
"009853","中加优势企业混合A"
"000015","华夏纯债债券A"
"501023","鹏华香港中小企业指数LOF"
"410009","华富量子生命力混合"
"008527","华泰柏瑞行业精选C"
"000338","鹏华双债保利债券"
"007012","湘财长顺混合发起式A"
"165515","信诚沪深300指数(LOF)"
"007258","凯石沣混合C"
"004854","广发中证全指汽车指数A"
"005675","易方达恒生国企ETF联接C"
"009624","安信稳健阿尔法定开混合C"
"519188","万家信用恒利债券A"
"001584","国投瑞银新活力定开混合A"
"000737","诺安聚利债券C"
"008119","鹏华金享混合"
"006477","中邮沪港深精选混合"
"008222","兴业机遇债券C"
"005231","红塔红土盛通混合型发起式A"
"007749","民生加银鹏程混合C"
"519153","新华纯债添利债券发起C"
"009488","中邮价值精选混合A"
"481009","工银沪深300指数A"
"003761","国泰中证500指数增强C"
"550018","信诚优质纯债债券A"
"009039","九泰久远量化驱动A"
"003301","华夏鼎融债券A"
"004855","广发中证全指汽车指数C"
"000335","安信永利信用C"
"007800","申万菱信沪深300价值指数C"
"005123","南方优享分红混合A"
"009489","中邮价值精选混合C"
"001013","华夏希望债券C"
"540009","汇丰晋信消费红利股票"
"485019","工银信用纯债债券B"
"006657","方正富邦中证500ETF联接C"
"400030","东方添益债券"
"000942","广发信息技术联接A"
"180026","银华信用双利债券C"
"001948","建信稳定丰利债券A"
"004254","民生加银汇鑫一年定开债A"
"004475","华泰柏瑞富利混合"
"005210","东吴双三角股票C"
"006937","工银沪深300指数C"
"009854","中加优势企业混合C"
"005232","红塔红土盛通混合型发起式C"
"501062","南方瑞合定开混合(LOF)"
"070037","嘉实纯债债券A"
"630003","华商收益增强债券A"
"160610","鹏华动力增长混合(LOF)"
"001408","建信鑫丰回报灵活配置混合A"
"000181","景顺长城四季金利债券A"
"001720","工银新增利混合"
"007013","湘财长顺混合发起式C"
"008950","平安匠心优选混合C"
"675100","西部利得得尊纯债A"
"001454","鹏华弘鑫混合C"
"002086","大成景安短融债券E"
"470007","汇添富上证综合指数"
"550005","信诚三得益债券B"
"002529","泰康安益纯债C"
"519023","海富通稳健添利债券C"
"371020","上投摩根纯债债券A"
"004361","上投摩根安通回报混合A"
"005524","泰康颐年混合C"
"160922","大成恒生综合中小型股指数A"
"002399","华安安禧混合C"
"003204","财通收益增强债券C"
"501105","建信金融债8-10年(LOF)"
"009040","九泰久远量化驱动C"
"270049","广发纯债债券C"
"001512","易方达中债3-5年期国债指数"
"004333","金鹰元盛债券型发起式E"
"004413","建信民丰回报混合"
